<?xml version="1.0" encoding="UTF-8"?>
<!DOCTYPE command SYSTEM "../../../../dtds/script-dao-commands.dtd">
<command name="test.http.insert-into-urls-symbols" type="SQL.UPDATE">
         <parameters>
                     <parameter name="urlId" />
                     <parameter name="fragment" />
                     <parameter name="parentFragment" />
                     <parameter name="symbolId" />
                     <parameter name="symbolPos" />
               </parameters>
      <script>
      insert into urls_symbols
values($urlId,$fragment,$parentFragment,$symbolId,$symbolPos)
   </script>
</command>